Наименование,Описание,Рубрики,Адрес,Комментарий к адресу,Почтовый индекс,Микрорайон,Район,Город,Округ,Регион,Страна,Часы работы,Часовой пояс,Рейтинг,Количество отзывов,Телефон 1,Телефон 2,Телефон 3,E-mail 1,E-mail 2,Веб-сайт 1,Веб-сайт 2,Веб-сайт 3,Twitter,ВКонтакте,WhatsApp 1,WhatsApp 2,WhatsApp 3,Viber 1,Viber 2,Viber 3,Telegram 1,Telegram 2,Telegram 3,YouTube,Широта,Долгота,2GIS URL,Тип
Мебельный магазин,,Мебель на заказ; Мебельные магазины; Мягкая мебель; Корпусная мебель; Мебель для кухни; Офисная мебель; Детская мебель,"улица 30 лет Победы, 4а ст3",,625007,,Калининский округ,Тюмень,Тюмень городской округ,Тюменская область,Россия,Пн: 09:30-18:30; Вт: 09:30-18:30; Ср: 09:30-18:30; Чт: 09:30-18:30; Пт: 09:30-18:30; Сб: 09:30-18:00; Вс: 10:00-18:00,+05:00,2.9,76,83452983150,89829481314,,,,,,,,,,,,,,,,,,,57.130519,65.55199,https://2gis.com/firm/70000001035438910,branch
Мебельный салон,,Мебель на заказ; Мебельные магазины; Мягкая мебель; Корпусная мебель; Детская мебель; Мебель для кухни,"Таллинская улица, 4а",5 павильон; цокольный этаж,625053,Войновка м-н,Восточный округ,Тюмень,Тюмень городской округ,Тюменская область,Россия,Пн: 10:00-19:00; Вт: 10:00-19:00; Ср: 10:00-19:00; Чт: 10:00-19:00; Пт: 10:00-19:00; Сб: 10:00-19:00; Вс: 10:00-19:00,+05:00,2.9,12,89326237955,,,,,,,,,https://vk.com/club158923847,,,,,,,,,,,57.099081,65.638202,https://2gis.com/firm/70000001030919669,branch
Мебельформ,,Мебель на заказ; Мебель для кухни; Офисная мебель; Корпусная мебель; Мебель для ванных комнат; Детская мебель,"Велижанский тракт 5 километр, 2 к1 ст3",,625059,,Ленинский округ,Тюмень,Тюмень городской округ,Тюменская область,Россия,Пн: 09:00-19:00; Вт: 09:00-19:00; Ср: 09:00-19:00; Чт: 09:00-19:00; Пт: 09:00-19:00; Сб: 09:00-19:00,+05:00,5.0,1,89829091120,,,,,,,,,https://vk.com/mebelform72,,,,,,,,,,,57.206305,65.620867,https://2gis.com/firm/70000001113423822,branch
Мебельщик,мастерская мебели,Мебель на заказ; Мебельные фасады; Корпусная мебель; Мебель для кухни; Мебель для ванных комнат; Детская мебель; Офисная мебель; Ремонт мебели,,,,,,Тюмень,Тюмень городской округ,Тюменская область,Россия,Пн: 08:00-21:00; Вт: 08:00-21:00; Ср: 08:00-21:00; Чт: 08:00-21:00; Пт: 08:00-21:00; Сб: 08:00-21:00; Вс: 08:00-21:00 (по предварительному звонку),+05:00,3.1,2,89950929192,,,,,,,,,,https://wa.me/79991902164,,,,,,https://t.me/+79991902164,,,,,,https://2gis.com/firm/70000001059620990,branch
Мебико,салон,Мебель на заказ; Мебель для кухни; Корпусная мебель; Мебель для ванных комнат; Детская мебель; Офисная мебель,"улица Константина Посьета, 14",,625042,,Восточный округ,Тюмень,Тюмень городской округ,Тюменская область,Россия,Пн: 10:00-20:00; Вт: 10:00-20:00; Ср: 10:00-20:00; Чт: 10:00-20:00; Пт: 10:00-20:00; Сб: 10:00-20:00; Вс: 10:00-20:00,+05:00,,,89199365823,,,,,,,,,,,,,,,,,,,,57.096543,65.574951,https://2gis.com/firm/70000001102942995,branch
Микс,мебельная компания,Мебель на заказ; Офисная мебель; Корпусная мебель; Мебель для кухни,"Камчатская улица, 202 ст1",3 бокс,625034,Тура м-н,Ленинский округ,Тюмень,Тюмень городской округ,Тюменская область,Россия,Пн: 09:00-18:00; Вт: 09:00-18:00; Ср: 09:00-18:00; Чт: 09:00-18:00; Пт: 09:00-18:00; Сб: 09:00-18:00; Вс: 09:00-18:00 (по предварительной записи),+05:00,5.0,8,89923006065,,,,,,,,,https://vk.com/mebelmix72,,,,,,,https://t.me/+79923006065,,,,57.150532,65.689813,https://2gis.com/firm/70000001047742559,branch
Мир интерьерных решений,салон отделочных материалов и мебели,Мебель на заказ; Декоративные отделочные материалы; Корпусная мебель; Детская мебель; Мебель для кухни; Напольные покрытия; Отделочные материалы; Обои; Керамическая плитка; Керамогранит; Лаки и краски; Светотехника; Стеновые панели; Сантехника; Межкомнатные двери; Перегородки; Дизайн интерьеров,"Комсомольская улица, 57",2 этаж,625002,,Центральный округ,Тюмень,Тюмень городской округ,Тюменская область,Россия,Пн: 10:00-19:00; Вт: 10:00-19:00; Ср: 10:00-19:00; Чт: 10:00-19:00; Пт: 10:00-19:00; Сб: 11:00-17:00,+05:00,4.9,76,83452576657 (отдел продаж),,,sale@mirpola.com,,,,,,https://vk.com/mirinteriera72,https://wa.me/79129206915,,,viber://chat/?number=79129206915,,,https://t.me/mirinteriera,,,,57.158498,65.553621,https://2gis.com/firm/70000001033042425,branch
Мир Искусства,багетная мастерская,Мебель на заказ; Художественные мастерские; Художественные товары; Широкоформатная печать; Багетные мастерские; Стекло и зеркала,"Невская улица, 35",1 этаж,625030,,Калининский округ,Тюмень,Тюмень городской округ,Тюменская область,Россия,Пн: 09:00-18:00; Вт: 09:00-18:00; Ср: 09:00-18:00; Чт: 09:00-18:00; Пт: 09:00-18:00; Сб: 10:00-17:00,+05:00,4.8,45,83452622849,,,,,,,,,https://vk.com/izoart72,https://wa.me/79820485670,,,,,,https://t.me/+79829485670,,,,57.128509,65.518014,https://2gis.com/firm/1830115629600325,branch
Мир Мебели,производственно-торговая компания,Мебель на заказ; Корпусная мебель; Мебель для кухни; Офисная мебель; Детская мебель,"Школьный переулок, 5 ст1",,625014,Зайкова м-н,Ленинский округ,Тюмень,Тюмень городской округ,Тюменская область,Россия,Пн: 09:00-18:00; Вт: 09:00-18:00; Ср: 09:00-18:00; Чт: 09:00-18:00; Пт: 09:00-18:00,+05:00,5.0,46,83452788827,89220711122,89923098434,,,,,,,,https://wa.me/79923098434,,,,,,https://t.me/+79923098434,,,,57.126116,65.664401,https://2gis.com/firm/70000001024367022,branch
Мир столов и стульев,мебельный салон,Мебель на заказ; Мебельные магазины; Мебель для кухни,"улица Федюнинского, 43",3 этаж,625062,Тюменский 3-й м-н,Восточный округ,Тюмень,Тюмень городской округ,Тюменская область,Россия,Пн: 10:00-21:00; Вт: 10:00-21:00; Ср: 10:00-21:00; Чт: 10:00-21:00; Пт: 10:00-21:00; Сб: 10:00-21:00; Вс: 10:00-21:00,+05:00,3.7,9,89129972549,,,,,,,,,,,,,,,,,,,,57.11227,65.545229,https://2gis.com/firm/70000001007530101,branch
Моя мебель,фабрика мебели,Мебель на заказ; Офисная мебель; Мебель для кухни; Корпусная мебель; Детская мебель; Изделия из камня для помещений; Матрасы; Мебель для ванных комнат; Металлоизделия,"Возрождения, 6а",2 этаж,625028,Суходольский м-н,Восточный округ,Тюмень,Тюмень городской округ,Тюменская область,Россия,Пн: 10:00-19:00; Вт: 10:00-19:00; Ср: 10:00-19:00; Чт: 10:00-19:00; Пт: 10:00-19:00 (по предварительному звонку),+05:00,4.8,17,83452605822,89292695822,,,,,,,,https://vk.com/club224410064,https://wa.me/79292695833,,,viber://chat/?number=79292695833,,,https://t.me/+79292695833,https://t.me/+79292695822,,,57.093403,65.596574,https://2gis.com/firm/70000001032076427,branch
Наргиз,салон-магазин,Мебель на заказ; Мягкая мебель; Мебельные магазины,"улица 30 лет Победы, 7/5",1 этаж,625007,,Калининский округ,Тюмень,Тюмень городской округ,Тюменская область,Россия,Пн: 10:00-19:00; Вт: 10:00-19:00; Ср: 10:00-19:00; Чт: 10:00-19:00; Пт: 10:00-19:00; Сб: 10:00-19:00; Вс: 10:00-19:00,+05:00,4.2,5,83452396016,,,,,,,,,,,,,,,,,,,,57.131692,65.557303,https://2gis.com/firm/1830115629609317,branch
Нева-Тура,компания по производству корпусной мебели,Мебель на заказ; Мебельные фасады; Корпусная мебель; Детская мебель; Офисная мебель; Мебель для кухни,"Мусы Джалиля, 13",1 этаж,625043,Парфёново м-н,Центральный округ,Тюмень,Тюмень городской округ,Тюменская область,Россия,Пн: 09:00-18:00; Вт: 09:00-18:00; Ср: 09:00-18:00; Чт: 09:00-18:00; Пт: 09:00-18:00 (по предварительному звонку),+05:00,5.0,2,89220737240,,,,,http://t.me/nevaturamebel,,,,https://vk.com/nevaturamebel,,,,,,,,,,,57.188464,65.546202,https://2gis.com/firm/1830115629795843,branch
Невские кухни,мебельный салон,Мебель на заказ; Мебельные магазины; Мебель для кухни; Корпусная мебель; Детская мебель,"улица 30 лет Победы, 7/5",1 этаж,625007,,Калининский округ,Тюмень,Тюмень городской округ,Тюменская область,Россия,Пн: 10:00-20:00; Вт: 10:00-20:00; Ср: 10:00-20:00; Чт: 10:00-20:00; Пт: 10:00-20:00; Сб: 10:00-20:00; Вс: 10:00-20:00,+05:00,4.8,24,83452595860,,,,,,,,,,,,,,,,,,,,57.132566,65.556005,https://2gis.com/firm/1830115629601947,branch
Нива,магазин,Мебель на заказ; Корпусная мебель; Мебель для кухни,"улица Московский тракт, 114",,625503,,,,Тюменский район,Тюменская область,Россия,"Пн: 08:00-13:00, 14:00-17:00; Вт: 08:00-13:00, 14:00-17:00; Ср: 08:00-13:00, 14:00-17:00; Чт: 08:00-13:00, 14:00-17:00; Пт: 08:00-13:00, 14:00-17:00; Сб: 08:00-13:00, 14:00-17:00",+05:00,,,,,,,,,,,,,,,,,,,,,,,57.075306,65.07596,https://2gis.com/firm/70000001114356688,branch
Новация,группа компания,Мебель на заказ; Мебель для учебных учреждений; Офисная мебель; Корпусная мебель; Детская мебель; Мебель для общественного питания; Мебель для культурно-досуговых учреждений; Оборудование для общепита; Проекционное оборудование; Мягкая мебель; Оборудование для образовательных учреждений,"Советская улица, 51 к1",8 секция; 6 этаж,625000,,Центральный округ,Тюмень,Тюмень городской округ,Тюменская область,Россия,Пн: 09:00-18:00; Вт: 09:00-18:00; Ср: 09:00-18:00; Чт: 09:00-18:00; Пт: 09:00-18:00 (по предварительному звонку),+05:00,5.0,25,88006008131 (многоканальный),83452548181 (многоканальный),,,,http://t.me/novacia72,,,,https://vk.com/novacia72,,,,,,,,,,,57.156196,65.54454,https://2gis.com/firm/70000001060091923,branch
Новый квартал,группа компаний,Мебель на заказ; Ремонт помещений; Остекление и отделка балконов,"улица 50 лет Октября, 57Б к1",1 этаж,625023,,Ленинский округ,Тюмень,Тюмень городской округ,Тюменская область,Россия,Пн: 08:00-20:00; Вт: 08:00-20:00; Ср: 08:00-20:00; Чт: 08:00-20:00; Пт: 08:00-20:00; Сб: 08:00-20:00; Вс: 08:00-20:00 (по предварительному звонку),+05:00,3.9,3,89827707272,,,,,,,,,,https://wa.me/79827707272,,,viber://chat/?number=79827707272,,,,,,,57.141495,65.594813,https://2gis.com/firm/70000001030066272,branch
Обстановка,компания по производству мебели,Мебель на заказ; Корпусная мебель; Мебель для кухни; Детская мебель; Офисная мебель; Мебель для ванных комнат; Мебель для салонов красоты; Мебель для общественного питания,"Старый Тобольский тракт 2 километр, 8 ст96",96/2 бокс; 1 этаж,625019,,Ленинский округ,Тюмень,Тюмень городской округ,Тюменская область,Россия,Пн: 08:00-19:00; Вт: 08:00-19:00; Ср: 08:00-19:00; Чт: 08:00-19:00; Пт: 08:00-19:00; Сб: 08:00-19:00,+05:00,5.0,4,89123981916,,,,,http://t.me/obstmn,,,,,https://wa.me/79123981916,,,,,,https://t.me/obstmn,,,,57.100951,65.684327,https://2gis.com/firm/70000001096242662,branch
Ольховский,,Мебель на заказ; Мебель для кухни; Корпусная мебель,"Оренбургская улица, 52/2",,625019,Букино м-н,Ленинский округ,Тюмень,Тюмень городской округ,Тюменская область,Россия,Пн: 08:00-18:00; Вт: 08:00-18:00; Ср: 08:00-18:00; Чт: 08:00-18:00; Пт: 08:00-18:00,+05:00,5.0,4,89199380961,,,,,,,,,https://vk.com/mebel.tumen,,,,,,,,,,,57.13466,65.624978,https://2gis.com/firm/70000001113541619,branch
Партнер,компания по производству мебельных фасадов,"Мебель на заказ; Мебельные фасады; Корпусная мебель; Фасадные материалы и конструкции; ЛДСП, ДВПО, МДФ","улица Щербакова, 170 к1",,625059,,Ленинский округ,Тюмень,Тюмень городской округ,Тюменская область,Россия,Пн: 09:00-18:00; Вт: 09:00-18:00; Ср: 09:00-18:00; Чт: 09:00-18:00; Пт: 09:00-18:00,+05:00,3.4,5,83452603355,83452693621,89220070296,,,,,,,,https://wa.me/79220070296,,,,,,,,,,57.199346,65.599896,https://2gis.com/firm/1830116630150441,branch
Первая Фабрика Кроватей-Трансформер,,Мебель на заказ; Мебельные магазины; Корпусная мебель; Детская мебель; Матрасы; Мебель для кухни; Мебель для ванных комнат; Офисная мебель,"улица Мельникайте, 104",3 этаж,625026,,Ленинский округ,Тюмень,Тюмень городской округ,Тюменская область,Россия,Пн: 10:00-20:00; Вт: 10:00-20:00; Ср: 10:00-20:00; Чт: 10:00-20:00; Пт: 10:00-20:00; Сб: 10:00-20:00; Вс: 10:00-20:00,+05:00,5.0,1,83452533080,,,,,,,,,https://vk.com/krovatitransformertmn,https://wa.me/79634523080,,,,,,https://t.me/+79634523080,,,,57.134125,65.563165,https://2gis.com/firm/70000001099302970,branch
Первая Фабрика Шкафов,,Мебель на заказ; Корпусная мебель; Детская мебель; Мебель для кухни; Мебель для ванных комнат; Офисная мебель,"улица Малышева, 2а ст3в",,625029,Тарманы м-н,Ленинский округ,Тюмень,Тюмень городской округ,Тюменская область,Россия,Пн: 09:00-18:00; Вт: 09:00-18:00; Ср: 09:00-18:00; Чт: 09:00-18:00; Пт: 09:00-18:00 (по предварительной записи),+05:00,5.0,118,89088796896,,,,,,,,,https://vk.com/fabshkaf,,,,,,,https://t.me/pfsh1,,,,57.190962,65.609723,https://2gis.com/firm/70000001062198448,branch
Перфекто,студия мебельных решений,Мебель на заказ; Мебельные магазины; Мебель для ванных комнат; Корпусная мебель; Мебель для кухни; Мебель для общественного питания; Офисная мебель,"Широтная улица, 209",2 этаж,625053,,Восточный округ,Тюмень,Тюмень городской округ,Тюменская область,Россия,Пн: 10:00-20:00; Вт: 10:00-20:00; Ср: 10:00-20:00; Чт: 10:00-20:00; Пт: 10:00-20:00; Сб: 10:00-20:00; Вс: 10:00-20:00 (по предварительному звонку),+05:00,4.9,17,83452952700,,,,,,,,,,,,,,,,https://t.me/+79044952700,,,,57.094473,65.626933,https://2gis.com/firm/70000001037188622,branch
Престиж,компания по изготовлению мебели,Мебель на заказ; Корпусная мебель; Детская мебель; Мебель для кухни; Офисная мебель; Мебель для ванных комнат,"Клары Цеткин, 59",104 офис; 1 этаж,625003,Дом обороны м-н,Калининский округ,Тюмень,Тюмень городской округ,Тюменская область,Россия,Пн: 10:00-18:00; Вт: 10:00-18:00; Ср: 10:00-18:00; Чт: 10:00-18:00; Пт: 10:00-18:00; Сб: 10:00-18:00 (по предварительному звонку),+05:00,,,89821322789,89923010623,,,,,,,,https://vk.com/m.prestizh72,https://wa.me/79821322789,,,,,,,,,,57.15083,65.502935,https://2gis.com/firm/70000001063475406,branch
Престиж,магазин мягкой мебели,Мебель на заказ; Мебельные магазины; Мягкая мебель,"улица Бакинских Комиссаров, 5",2 этаж,625041,Дом обороны м-н,Калининский округ,Тюмень,Тюмень городской округ,Тюменская область,Россия,Пн: 10:00-19:00; Вт: 10:00-19:00; Ср: 10:00-19:00; Чт: 10:00-19:00; Пт: 10:00-19:00; Сб: 10:00-19:00; Вс: 10:00-19:00,+05:00,3.7,3,83452529988,,,,,,,,,,,,,,,,,,,,57.160061,65.480419,https://2gis.com/firm/70000001055225036,branch
Престиж,магазин мягкой мебели,Мебель на заказ; Мебельные магазины; Мягкая мебель,"улица 30 лет Победы, 7/5",1 этаж,625007,,Калининский округ,Тюмень,Тюмень городской округ,Тюменская область,Россия,Пн: 10:00-20:00; Вт: 10:00-20:00; Ср: 10:00-20:00; Чт: 10:00-20:00; Пт: 10:00-20:00; Сб: 10:00-20:00; Вс: 10:00-20:00,+05:00,4.7,3,83452396080,,,,,,,,,,,,,,,,,,,,57.132459,65.555864,https://2gis.com/firm/70000001037650627,branch
Про Металл,производственная компания,Мебель на заказ; Металлоконструкции для строительства; Металлообработка; Сварочные работы,"Старый Тобольский тракт 5 километр, 3 ст2",18 бокс; цокольный этаж,625047,Антипино м-н,Ленинский округ,Тюмень,Тюмень городской округ,Тюменская область,Россия,Пн: 08:00-20:00; Вт: 08:00-20:00; Ср: 08:00-20:00; Чт: 08:00-20:00; Пт: 08:00-20:00; Сб: 08:00-20:00,+05:00,5.0,7,89995002414,89504962114,,,,,,,,,https://wa.me/79995002414,,,,,,https://t.me/+79995002414,,,,57.110961,65.751926,https://2gis.com/firm/70000001075832556,branch
Проект-Мебель,мебельный салон,Мебель на заказ; Мягкая мебель; Корпусная мебель,"Молодёжная улица, 80 ст4",,625007,,Калининский округ,Тюмень,Тюмень городской округ,Тюменская область,Россия,Пн: 10:00-19:00; Вт: 10:00-19:00; Ср: 10:00-19:00; Чт: 10:00-19:00; Пт: 10:00-19:00; Сб: 10:00-18:00; Вс: 10:00-18:00,+05:00,,,89827845016,,,,,,,,,,,,,,,,,,,,57.130306,65.550629,https://2gis.com/firm/70000001114306252,branch
Проект-Мебель,мебельный салон,Мебель на заказ; Мягкая мебель; Корпусная мебель,"улица Пермякова, 1а",2 этаж,625013,,Ленинский округ,Тюмень,Тюмень городской округ,Тюменская область,Россия,Пн: 10:00-18:00; Вт: 10:00-18:00; Ср: 10:00-18:00; Чт: 10:00-18:00; Пт: 10:00-18:00; Сб: 10:00-18:00; Вс: 10:00-18:00,+05:00,5.0,3,89827845016,,,,,,,,,,,,,,,,,,,,57.134662,65.606176,https://2gis.com/firm/70000001114306248,branch
Производственная компания,,Мебель на заказ; Офисная мебель; Корпусная мебель; Мебель для кухни; Стеллажи и витрины,"Березовская улица, 42",,625061,Утешево м-н,Калининский округ,Тюмень,Тюмень городской округ,Тюменская область,Россия,Пн: 09:00-18:00; Вт: 09:00-18:00; Ср: 09:00-18:00; Чт: 09:00-18:00; Пт: 09:00-18:00 (по предварительному звонку),+05:00,5.0,1,89068758404,,,,,,,,,,https://wa.me/79068758404,,,viber://chat/?number=79068758404,,,,,,,57.155464,65.361207,https://2gis.com/firm/1830115629935761,branch
Производственная мебельная компания,,Мебель на заказ; Мебель для кухни; Корпусная мебель,"Старый Тобольский тракт 5 километр, 3 ст2",,625047,Антипино м-н,Ленинский округ,Тюмень,Тюмень городской округ,Тюменская область,Россия,Пн: 00:00-24:00,+05:00,,,89630571155,,,,,,,,,https://vk.com/akuhniishkafi72,,,,,,,,,,,57.110972,65.751367,https://2gis.com/firm/70000001114964856,branch
Простор 72,мебельный салон,Мебель на заказ; Мебельные магазины; Корпусная мебель; Мягкая мебель; Мебель для кухни; Детская мебель; Матрасы,"улица Островского, 34 ст1",1 этаж,625504,,,,Тюменский район,Тюменская область,Россия,Пн: 10:00-20:00; Вт: 10:00-20:00; Ср: 10:00-20:00; Чт: 10:00-20:00; Пт: 10:00-20:00; Сб: 10:00-20:00; Вс: 10:00-20:00,+05:00,3.1,5,89324864744,89222694174,89222688707,,,,,,,https://vk.com/prostor72t,https://wa.me/79222694174,https://wa.me/79324864744,,,,,https://t.me/+79222694174,,,,57.044659,65.721651,https://2gis.com/firm/70000001041155519,branch
Просториум,,Мебель на заказ; Ремонт помещений,"улица Александра Пушкина, 14",7 помещение; 1 этаж,625062,,,,Тюменский район,Тюменская область,Россия,Пн: 10:00-19:00; Вт: 10:00-19:00; Ср: 10:00-19:00; Чт: 10:00-19:00; Пт: 10:00-19:00; Сб: 10:00-15:00; Вс: 10:00-19:00 (по предварительной записи: вс),+05:00,5.0,3,89059224154,89323281452,89920050211,,,,,,,,,,,,,,,,,,57.090554,65.509162,https://2gis.com/firm/70000001113230489,branch
