Наименование,Описание,Рубрики,Адрес,Комментарий к адресу,Почтовый индекс,Микрорайон,Район,Город,Округ,Регион,Страна,Часы работы,Часовой пояс,Рейтинг,Количество отзывов,Телефон 1,Телефон 2,Телефон 3,E-mail 1,E-mail 2,Веб-сайт 1,Веб-сайт 2,Веб-сайт 3,Twitter,ВКонтакте,WhatsApp 1,WhatsApp 2,WhatsApp 3,Viber 1,Viber 2,Viber 3,Telegram 1,Telegram 2,Telegram 3,YouTube,Широта,Долгота,2GIS URL,Тип
Пространство,компания мебели на заказ,Мебель на заказ; Корпусная мебель,"Сахалинская улица, 14",,625034,,Ленинский округ,Тюмень,Тюмень городской округ,Тюменская область,Россия,Пн: 09:00-18:00; Вт: 09:00-18:00; Ср: 09:00-18:00; Чт: 09:00-18:00; Пт: 09:00-18:00,+05:00,,,89619999986,,,,,,,,,https://vk.com/prostranstvomeb,,,,,,,,,,,57.15451,65.624083,https://2gis.com/firm/70000001115288431,branch
Профас72,фабрика мебельных фасадов,Мебель на заказ; Мебельные фасады,"Судостроителей, 35",,625034,,Ленинский округ,Тюмень,Тюмень городской округ,Тюменская область,Россия,Пн: 09:00-18:00; Вт: 09:00-18:00; Ср: 09:00-18:00; Чт: 09:00-18:00; Пт: 09:00-18:00,+05:00,5.0,8,89129244747,89829147316,,,,,,,,,,,,,,,,,,,57.159622,65.645224,https://2gis.com/firm/70000001057196383,branch
Профстолоф,производственная компания,Мебель на заказ; Оборудование для салонов красоты; Массажное оборудование; Корпусная мебель; Мебель для салонов красоты,"Пархоменко, 54",1 этаж,625032,,Калининский округ,Тюмень,Тюмень городской округ,Тюменская область,Россия,Пн: 10:00-18:00; Вт: 10:00-18:00; Ср: 10:00-18:00; Чт: 10:00-18:00; Пт: 10:00-18:00; Сб: 11:00-15:00,+05:00,3.7,39,89617810299,,,,,,,,,https://vk.com/id315589560,https://wa.me/79617810299,,,viber://chat/?number=79617810299,,,https://t.me/+79617810299,,,,57.129798,65.520389,https://2gis.com/firm/70000001024508862,branch
Пять Звезд,мебельное ателье,"Мебель на заказ; Корпусная мебель; Распиловка древесины; Офисная мебель; Мебельная фурнитура; Мебель для кухни; Мебель для ванных комнат; ДСП, ДВП, фанера; Мебельные фасады; ЛДСП, ДВПО, МДФ; Детская мебель; Ремонт мебели","улица Новаторов, 5 ст1/3",4 складское помещение,625019,,Ленинский округ,Тюмень,Тюмень городской округ,Тюменская область,Россия,Пн: 09:00-18:00; Вт: 09:00-18:00; Ср: 09:00-18:00; Чт: 09:00-18:00; Пт: 09:00-18:00,+05:00,5.0,3,89526801570,,,,,,,,,,https://wa.me/79526801570,,,,,,https://t.me/+79526801570,,,,57.115642,65.616645,https://2gis.com/firm/70000001111255746,branch
Региональная Строительно Производственная Компания,,Мебель на заказ; Строительство дач и коттеджей; Строительство дорог; Ремонт помещений; Дизайн интерьеров,"Усадебная улица, 91а",3 офис; 2 этаж,625043,Нефтяников м-н,Центральный округ,Тюмень,Тюмень городской округ,Тюменская область,Россия,"Пн: 09:00-13:00, 14:00-18:00; Вт: 09:00-13:00, 14:00-18:00; Ср: 09:00-13:00, 14:00-18:00; Чт: 09:00-13:00, 14:00-18:00; Пт: 09:00-13:00, 14:00-18:00; Сб: 09:00-13:00, 14:00-18:00",+05:00,5.0,2,89323237333,,,,,,,,,https://vk.com/id888597215,,,,,,,,,,,57.200285,65.589164,https://2gis.com/firm/70000001112990085,branch
РК-мебель,салон мебели под заказ,Мебель на заказ; Мебельные магазины; Корпусная мебель; Мебель для кухни; Офисная мебель; Мебель для ванных комнат,"улица Евгения Войнова, 7",,625031,5-й заречный м-н,Центральный округ,Тюмень,Тюмень городской округ,Тюменская область,Россия,Пн: 10:00-19:00; Вт: 10:00-19:00; Ср: 10:00-19:00; Чт: 10:00-19:00; Пт: 10:00-19:00; Сб: 10:00-19:00; Вс: 10:00-19:00,+05:00,5.0,16,89993650777,,,aksenova.84@mail.ru,,http://rkmebel72.ru/?utm_source=2gis&utm_medium=organic&utm_campaign=2gis,,,,https://vk.com/public204380514,https://wa.me/79220818818,,,viber://chat/?number=79220818818,,,https://t.me/+79220818818,,,,57.171292,65.582418,https://2gis.com/firm/70000001100680370,branch
РК-мебель,салон мебели под заказ,Мебель на заказ; Корпусная мебель; Детская мебель; Мягкая мебель; Мебель из стекла; Изделия из камня для помещений; Мебель для кухни; Офисная мебель; Мебель для ванных комнат,"Михаила Лермонтова улица, 6",,625062,,,,Тюменский район,Тюменская область,Россия,Пн: 10:00-19:00; Вт: 10:00-19:00; Ср: 10:00-19:00; Чт: 10:00-19:00; Пт: 10:00-19:00; Сб: 10:00-19:00; Вс: 10:00-19:00 (по предварительной записи: сб-вс),+05:00,4.9,47,89220818818,,,aksenova.84@mail.ru,,http://rkmebel72.ru/?utm_source=2gis&utm_medium=organic&utm_campaign=2gis,,,,https://vk.com/public204380514,https://wa.me/79220818818,,,viber://chat/?number=79220818818,,,https://t.me/+79220818818,,,,57.08995,65.517284,https://2gis.com/firm/70000001069059355,branch
РК-мебель,салон мебели под заказ,Мебель на заказ; Мебельные магазины; Корпусная мебель; Мебель для кухни; Офисная мебель; Мебель для ванных комнат,"Пароходская улица, 4",2 этаж; 2 подъезд,625002,,Центральный округ,Тюмень,Тюмень городской округ,Тюменская область,Россия,Пн: 10:00-19:00; Вт: 10:00-19:00; Ср: 10:00-19:00; Чт: 10:00-19:00; Пт: 10:00-19:00; Сб: 10:00-19:00; Вс: 10:00-19:00,+05:00,5.0,98,89222634543,,,aksenova.84@mail.ru,,http://rkmebel72.ru/?utm_source=2gis&utm_medium=organic&utm_campaign=2gis,,,,https://vk.com/public204380514,https://wa.me/79222634543,,,viber://chat/?number=79220818818,,,https://t.me/+79220818818,,,,57.161025,65.553861,https://2gis.com/firm/70000001057849058,branch
Русь,мебельный комбинат,Мебель на заказ; Мебельные фасады; Мебельные фабрики; Мебель для кухни; Корпусная мебель; Мебель для ванных комнат,"Большая Заречная улица, 41",,625005,Заречный м-н,Центральный округ,Тюмень,Тюмень городской округ,Тюменская область,Россия,"Пн: 08:30-12:00, 13:00-17:30; Вт: 08:30-12:00, 13:00-17:30; Ср: 08:30-12:00, 13:00-17:30; Чт: 08:30-12:00, 13:00-17:30; Пт: 08:30-12:00, 13:00-17:30",+05:00,5.0,6,89222477272,89324850101,,,,,,,,https://vk.com/mkrus72,https://wa.me/79222477272,,,,,,https://t.me/+79324850101,,,,57.172341,65.519006,https://2gis.com/firm/70000001084281067,branch
РусьМебель,мебельная фабрика,Мебель на заказ; Корпусная мебель; Мягкая мебель; Матрасы; Мебель для кухни,"Дамбовская улица, 10 ст1",,625034,,Ленинский округ,Тюмень,Тюмень городской округ,Тюменская область,Россия,Пн: 09:00-18:00; Вт: 09:00-18:00; Ср: 09:00-18:00; Чт: 09:00-18:00; Пт: 09:00-18:00; Сб: 09:00-18:00,+05:00,4.9,2,89829481314,,,,,,,,,,https://wa.me/79044983150,,,,,,,,,,57.151224,65.610846,https://2gis.com/firm/1830115629747209,branch
Сайф Тимер,,Мебель на заказ; Кованые изделия; Садово-парковая мебель; Сварочные работы,"улица Тилимбаева, 26",,625516,,,,Тюменский район,Тюменская область,Россия,,+05:00,,,89199499506,,,,,,,,,,,,,,,,,,,,57.069362,65.809996,https://2gis.com/firm/70000001112647104,branch
Светлый выбор,"компания по изготовлению корпусной мебели под заказ кухни, шкафы, фасады, и изготовление конструкций из ПВХ",Мебель на заказ; Остекление и отделка балконов; Окна; Теплоизоляционные материалы; Входные группы,"улица Дружбы, 227 ст11",,625031,Тарманы м-н,Ленинский округ,Тюмень,Тюмень городской округ,Тюменская область,Россия,Пн: 09:00-18:00; Вт: 09:00-18:00; Ср: 09:00-18:00; Чт: 09:00-18:00; Пт: 09:00-18:00,+05:00,4.8,20,83452472410,89324739292,,svetliy.vybor@yandex.ru,,,,,,https://vk.com/svetliyvybortmn,,,,,,,https://t.me/+79324739292,,,,57.179635,65.602287,https://2gis.com/firm/70000001095207395,branch
Свой стиль,мебельная компания,Мебель на заказ; Мебель для кухни; Корпусная мебель; Офисная мебель; Мебельные фасады; Мебель для общественного питания; Мебель для учебных учреждений; Стеллажи и витрины; Торгово-выставочное оборудование; Перегородки,"улица Муллы-Нур Вахитова, 5а ст2",,625043,Парфёново м-н,Центральный округ,Тюмень,Тюмень городской округ,Тюменская область,Россия,Пн: 09:00-18:00; Вт: 09:00-18:00; Ср: 09:00-18:00; Чт: 09:00-18:00; Пт: 09:00-18:00; Сб: 09:00-18:00; Вс: 09:00-18:00 (по предварительному звонку: сб-вс),+05:00,5.0,30,89829821114,,,,,,,,,,https://wa.me/79829821114,,,viber://chat/?number=79829821114,,,https://t.me/+79829821114,,,,57.190659,65.543918,https://2gis.com/firm/70000001090639402,branch
Сдс,мебельная компания,Мебель на заказ; Офисная мебель; Корпусная мебель; Мебель для кухни; Мебель для учебных учреждений,,,,,,Тюмень,Тюмень городской округ,Тюменская область,Россия,Пн: 10:00-18:30; Вт: 10:00-18:30; Ср: 10:00-18:30; Чт: 10:00-18:30; Пт: 10:00-18:30; Сб: 10:00-15:00,+05:00,,,89129258926,,,,,,,,,,https://wa.me/79129258926,,,viber://chat/?number=79129258926,,,,,,,,,https://2gis.com/firm/1830115629596826,branch
Семёновские кухни,,Мебель на заказ; Мебель для кухни; Корпусная мебель; Мебельные фасады,"улица Константина Заслонова, 37 ст3",ворота 16,625034,,Ленинский округ,Тюмень,Тюмень городской округ,Тюменская область,Россия,Пн: 09:00-20:00; Вт: 09:00-20:00; Ср: 09:00-20:00; Чт: 09:00-20:00; Пт: 09:00-20:00; Сб: 09:00-20:00 (по предварительной записи),+05:00,5.0,8,89292692672,83452602672,,,,,,,,https://vk.com/kuhni72tmn,https://wa.me/79292692672,,,,,,https://t.me/+79292692672,,,,57.161038,65.646974,https://2gis.com/firm/70000001080663583,branch
Семья,мебельный салон,Мебель на заказ; Мебельные магазины; Мягкая мебель; Мебель для кухни; Корпусная мебель; Детская мебель; Матрасы,"Московский тракт, 120 ст2",272 место; 201 павильон; 2 этаж,625049,,Калининский округ,Тюмень,Тюмень городской округ,Тюменская область,Россия,Пн: 09:00-18:30; Вт: 09:00-18:30; Ср: 09:00-18:30; Чт: 09:00-18:30; Пт: 09:00-18:30; Сб: 09:00-18:30; Вс: 09:00-18:30,+05:00,3.5,36,89199377374,,,,,,,,,,https://wa.me/79199377374,,,,,,,,,,57.13411,65.490736,https://2gis.com/firm/70000001042834723,branch
Сервис мебель,фабрика,Мебель на заказ; Офисная мебель; Корпусная мебель; Мебель для кухни; Мягкая мебель; Детская мебель,"Барабинская улица, 3 ст26",37 складское помещение,625034,,Ленинский округ,Тюмень,Тюмень городской округ,Тюменская область,Россия,Пн: 08:00-17:00; Вт: 08:00-17:00; Ср: 08:00-17:00; Чт: 08:00-17:00; Пт: 08:00-17:00; Сб: 08:00-17:00; Вс: 08:00-17:00,+05:00,,,89123990742,,,,,,,,,,https://wa.me/79123990742,,,,,,,,,,57.158133,65.603112,https://2gis.com/firm/70000001090175721,branch
Сиблес,мебельный магазин,Мебель на заказ; Мебельные магазины; Детская мебель; Матрасы; Мебель для кухни; Мебельные фабрики; Мебельные фасады; Стеновые панели; Бытовая техника; Корпусная мебель; Мягкая мебель; Мебель для ванных комнат,"Ветеранов Труда, 58 ст1",2 этаж,625031,,Ленинский округ,Тюмень,Тюмень городской округ,Тюменская область,Россия,Пн: 10:00-19:00; Вт: 10:00-19:00; Ср: 10:00-19:00; Чт: 10:00-19:00; Пт: 10:00-19:00; Сб: 10:00-18:00; Вс: 10:00-18:00,+05:00,4.2,10,83452470100,,,,,,,,,,https://wa.me/79220771017,,,,,,https://t.me/+79220771017,,,,57.195987,65.595772,https://2gis.com/firm/70000001066041512,branch
Слава,мебельная компания,"Мебель на заказ; Мебельные фасады; Мебель для кухни; Корпусная мебель; Офисная мебель; Детская мебель; Распиловка древесины; Ремонт мебели; ЛДСП, ДВПО, МДФ","Газопромысловая улица, 1 ст2",1 этаж,625029,Тарманы м-н,Ленинский округ,Тюмень,Тюмень городской округ,Тюменская область,Россия,Пн: 10:00-18:00; Вт: 10:00-18:00; Ср: 10:00-18:00; Чт: 10:00-18:00; Пт: 10:00-18:00,+05:00,4.0,18,89044924463 (единый номер: пн-пт 10:00-18:00),83452924463 (единый номер: пн-пт 10:00-18:00),89129982311 (единый номер: пн-пт 10:00-18:00),,,,,,,,https://wa.me/79129982311,,,,,,,,,,57.185551,65.624839,https://2gis.com/firm/1830115629700435,branch
Слава,Производственный цех,Мебель на заказ; Мебель для кухни; Корпусная мебель; Офисная мебель; Детская мебель; Распиловка древесины; Ремонт мебели; Мебельные фасады,"улица Чекистов, 26 ст14",1 этаж; база Кедр,625014,Строителей пос.,Ленинский округ,Тюмень,Тюмень городской округ,Тюменская область,Россия,Пн: 10:00-17:00; Вт: 10:00-17:00; Ср: 10:00-17:00; Чт: 10:00-17:00; Пт: 10:00-17:00,+05:00,4.8,12,89044924463 (единый номер: пн-пт 10:00-18:00),83452924463 (единый номер: пн-пт 10:00-18:00),89129982311 (единый номер: пн-пт 10:00-18:00),,,,,,,,https://wa.me/79129982311,,,,,,,,,,57.109785,65.65367,https://2gis.com/firm/70000001039521130,branch
Стальмебель,торгово-производственная компания,Мебель на заказ; Металлическая мебель; Сварочные работы; Металлоизделия; Заборы и ограждения; Металлоконструкции для строительства; Металлообработка; Полимерная порошковая окраска,"улица Чекистов, 30 ст7",,625014,Строителей пос.,Ленинский округ,Тюмень,Тюмень городской округ,Тюменская область,Россия,Пн: 09:00-20:00; Вт: 09:00-20:00; Ср: 09:00-20:00; Чт: 09:00-20:00; Пт: 09:00-20:00; Сб: 09:00-20:00 (по предварительному звонку),+05:00,5.0,3,89923033577,89220091099,,,,,,,,https://vk.com/stalmebel72,https://wa.me/79220091099,https://wa.me/79923033577,,viber://chat/?number=79220091099,,,,,,,57.113248,65.650106,https://2gis.com/firm/70000001045405245,branch
Стальной Бродяга,компания,Мебель на заказ; Металлообработка; Металлоконструкции для строительства; Теплицы,"Ямская улица, 105 ст3",5 цех,625017,РТС м-н,Калининский округ,Тюмень,Тюмень городской округ,Тюменская область,Россия,Пн: 08:00-17:00; Вт: 08:00-17:00; Ср: 08:00-17:00; Чт: 08:00-17:00; Пт: 08:00-17:00; Сб: 08:00-17:00; Вс: 08:00-17:00,+05:00,5.0,4,89617824687,,,,,,,,,https://vk.com/steel.tramp,https://wa.me/79630568568,https://wa.me/79617824687,,,,,,,,,57.156536,65.47294,https://2gis.com/firm/70000001075764734,branch
Стефания,мебельный салон,Мебель на заказ; Мебельные магазины; Корпусная мебель; Мебель для кухни,"Николая Чаплина улица, 115а",2 этаж,625007,,Калининский округ,Тюмень,Тюмень городской округ,Тюменская область,Россия,Вт: 10:00-18:00; Ср: 10:00-18:00; Чт: 10:00-18:00; Пт: 10:00-18:00; Сб: 10:00-18:00,+05:00,4.3,12,89199370710,,,,,,,,,https://vk.com/stefaniya72,https://wa.me/79199370710,,,,,,https://t.me/+79199370710,,,,57.128808,65.53959,https://2gis.com/firm/70000001039926243,branch
Стильное пространство,компания по изготовлению мебели под заказ,Мебель на заказ; Корпусная мебель; Мебель для кухни; Детская мебель; Мебель для ванных комнат; Офисная мебель,"проезд Воронинские горки, 142 ст3",,625056,,Калининский округ,Тюмень,Тюмень городской округ,Тюменская область,Россия,Пн: 09:00-18:00; Вт: 09:00-18:00; Ср: 09:00-18:00; Чт: 09:00-18:00; Пт: 09:00-18:00; Сб: 10:00-15:00,+05:00,5.0,11,89199242016,,,,,,,,,https://vk.com/stilnoe_prostranstvo,https://wa.me/79199242016,,,,,,https://t.me/+79199242016,,,,57.186545,65.461752,https://2gis.com/firm/70000001087011208,branch
Столин,салон столов и стульев,Мебель на заказ; Корпусная мебель; Мебель для кухни,"улица 30 лет Победы, 7/5",2 этаж,625007,,Калининский округ,Тюмень,Тюмень городской округ,Тюменская область,Россия,Пн: 10:00-20:00; Вт: 10:00-20:00; Ср: 10:00-20:00; Чт: 10:00-20:00; Пт: 10:00-20:00; Сб: 10:00-20:00; Вс: 10:00-20:00,+05:00,5.0,6,89292688300,,,,,,,,,https://vk.com/stolin.home72,,,,,,,https://t.me/+79292688300,,,,57.131605,65.556068,https://2gis.com/firm/70000001094230666,branch
Столярная мастерская,,Мебель на заказ; Мебель для ванных комнат; Деревообработка; Садово-парковая мебель; Интерьерные лестницы; Декоративные отделочные материалы; Строительство дач и коттеджей; Корпусная мебель,"Велижанский тракт 5 километр, 37/1",,625059,,Центральный округ,Тюмень,Тюмень городской округ,Тюменская область,Россия,Пн: 10:00-20:00; Вт: 10:00-20:00; Ср: 10:00-20:00; Чт: 10:00-20:00; Пт: 10:00-20:00; Сб: 10:00-20:00; Вс: 10:00-20:00 (по предварительной записи),+05:00,4.7,14,89123890559,89048894180,,,,http://t.me/mebellofttmn,,,,,https://wa.me/79123890559,https://wa.me/79048894180,,,,,https://t.me/+79123890559,,,,57.213888,65.628826,https://2gis.com/firm/70000001066392475,branch
Столярная мастерская,,Мебель на заказ; Деревообработка; Детская мебель; Корпусная мебель; Мебель для кухни; Ремонт мебели; Мебель для ванных комнат,"улица 50 лет Октября, 120 ст4",,625013,,Ленинский округ,Тюмень,Тюмень городской округ,Тюменская область,Россия,Пн: 09:30-18:30; Вт: 09:30-18:30; Ср: 09:30-18:30; Чт: 09:30-18:30; Пт: 09:30-18:30 (по предварительному звонку),+05:00,4.0,8,89026208297,,,,,,,,,https://vk.com/id789514687,https://wa.me/79026208297,,,,,,https://t.me/+79026208297,,,,57.132039,65.605555,https://2gis.com/firm/70000001051334828,branch
Столярная мастерская,,Мебель на заказ; Детская мебель; Деревообработка; Мебель для кухни; Интерьерные лестницы,"Дамбовская улица, 41 ст4",,625034,,Ленинский округ,Тюмень,Тюмень городской округ,Тюменская область,Россия,Пн: 09:00-18:00; Вт: 09:00-18:00; Ср: 09:00-18:00; Чт: 09:00-18:00; Пт: 09:00-18:00 (по предварительному звонку),+05:00,1.7,1,83452481614,,,,,,,,,,,,,,,,,,,,57.15424,65.616972,https://2gis.com/firm/70000001037752013,branch
Столярный цех,,Мебель на заказ; Деревообработка; Интерьерные лестницы; Погонажные изделия; Фрезеровка неметаллов,"Московский тракт, 133",цокольный этаж,625049,,Калининский округ,Тюмень,Тюмень городской округ,Тюменская область,Россия,Пн: 09:00-18:00; Вт: 09:00-18:00; Ср: 09:00-18:00; Чт: 09:00-18:00; Пт: 09:00-18:00,+05:00,,,89220492991,,,,,http://dzen.ru/id/6a154d53a6ed872630d516d1?share_to=link,,,,,,,,,,,https://t.me/+79220492991,,,,57.132659,65.494949,https://2gis.com/firm/70000001110769067,branch
Студия кухни Виталия Жукова,,Мебель на заказ; Мебельные магазины; Мебель для кухни; Корпусная мебель; Детская мебель,"улица Республики, 205 к1",10 офис; 1 этаж,625019,,Ленинский округ,Тюмень,Тюмень городской округ,Тюменская область,Россия,Пн: 10:00-19:00; Вт: 10:00-19:00; Ср: 10:00-19:00; Чт: 10:00-19:00; Пт: 10:00-19:00; Сб: 10:00-19:00; Вс: 10:00-19:00,+05:00,4.8,92,83452381091,89829481091,,,,,,,,https://vk.com/skuhni,,,,,,,https://t.me/+79829481091,,,,57.127023,65.597185,https://2gis.com/firm/70000001025742885,branch
Студия мебели индивидуального производства,,Мебель на заказ; Корпусная мебель; Мебель для кухни; Мебель для ванных комнат; Детская мебель; Мебельные фасады,"Академический проезд, 5 ст1",114 офис; 1 этаж,625063,Московский Дворик м-н,,,Тюменский район,Тюменская область,Россия,Ср: 10:00-19:00; Чт: 10:00-19:00; Пт: 10:00-19:00; Сб: 10:00-19:00; Вс: 10:00-19:00,+05:00,,,89667617587,,,,,,,,,,https://wa.me/79667617587,,,,,,https://t.me/+79667617587,,,,57.119915,65.46522,https://2gis.com/firm/70000001102205207,branch
Т-Мебель,,Мебель на заказ; Корпусная мебель,"улица Малышева, 2а ст3в",,625029,Тарманы м-н,Ленинский округ,Тюмень,Тюмень городской округ,Тюменская область,Россия,Пн: 09:00-20:00; Вт: 09:00-20:00; Ср: 09:00-20:00; Чт: 09:00-20:00; Пт: 09:00-20:00; Сб: 09:00-20:00,+05:00,5.0,7,89220404343,,,,,,,,,,,,,,,,,,,,57.190908,65.609741,https://2gis.com/firm/70000001110653183,branch
