Наименование,Описание,Рубрики,Адрес,Комментарий к адресу,Почтовый индекс,Микрорайон,Район,Город,Округ,Регион,Страна,Часы работы,Часовой пояс,Рейтинг,Количество отзывов,Телефон 1,Телефон 2,Телефон 3,E-mail 1,E-mail 2,Веб-сайт 1,Веб-сайт 2,Веб-сайт 3,Twitter,ВКонтакте,WhatsApp 1,WhatsApp 2,WhatsApp 3,Viber 1,Viber 2,Viber 3,Telegram 1,Telegram 2,Telegram 3,YouTube,Широта,Долгота,2GIS URL,Тип
К-артель,кузница,Мебель на заказ; Металлоконструкции для строительства; Заборы и ограждения; Автоматические ворота и шлагбаумы; Кованые изделия,"Светлая улица, 11",,,Серебряный бор+,,,Тюменский район,Тюменская область,Россия,Пн: 08:00-20:00; Вт: 08:00-20:00; Ср: 08:00-20:00; Чт: 08:00-20:00; Пт: 08:00-20:00; Сб: 08:00-20:00,+05:00,5.0,7,89829100600,89829165541,,,,,,,,https://vk.com/k_artel72,https://wa.me/79829100600,https://wa.me/79829165541,,viber://chat/?number=79829165541,viber://chat/?number=79829100600,,https://t.me/+79829165541,,,,57.114705,65.869692,https://2gis.com/firm/70000001077240789,branch
Кабриоль,производственно-сервисная компания,Мебель на заказ; Офисная мебель; Мягкая мебель; Мебель для общественного питания; Мебельные ткани; Ремонт мебели; Детская мебель,"улица Черепанова, 80",1 этаж,625017,РТС м-н,Калининский округ,Тюмень,Тюмень городской округ,Тюменская область,Россия,Пн: 12:00-18:00; Вт: 12:00-18:00; Ср: 12:00-18:00; Чт: 12:00-18:00; Пт: 12:00-18:00; Сб: 12:00-16:00 (по предварительному звонку),+05:00,,,89120799496,,,,,,,,,,https://wa.me/79120799496,,,,,,,,,,57.151564,65.451059,https://2gis.com/firm/1830115629736991,branch
Калина,многопрофильная компания,Мебель на заказ; Ремонт помещений; Дизайн интерьеров; Мебель для кухни; Натяжные потолки; Монтаж климатических систем,"Червишевский тракт, 37",307 офис; 3 этаж,625062,Южный м-н,Калининский округ,Тюмень,Тюмень городской округ,Тюменская область,Россия,Пн: 09:00-18:00; Вт: 09:00-18:00; Ср: 09:00-18:00; Чт: 09:00-18:00; Пт: 09:00-18:00; Сб: 09:00-18:00; Вс: 09:00-18:00,+05:00,5.0,1,89229007272,,,,,,,,,https://vk.com/remontkalina,,,,,,,,,,,57.120424,65.522027,https://2gis.com/firm/70000001112065701,branch
Каприз,мебельный салон,Мебель на заказ; Мягкая мебель; Мебель для кухни; Корпусная мебель; Детская мебель,"улица 30 лет Победы, 7/5",1 этаж,625007,,Калининский округ,Тюмень,Тюмень городской округ,Тюменская область,Россия,Пн: 10:00-19:00; Вт: 10:00-19:00; Ср: 10:00-19:00; Чт: 10:00-19:00; Пт: 10:00-19:00; Сб: 10:00-19:00; Вс: 10:00-19:00,+05:00,,,89097341585,,,,,,,,,https://vk.com/id645335615,,,,,,,https://t.me/+79097341585,,,,57.132463,65.556057,https://2gis.com/firm/70000001100230238,branch
Каприз,мебельный салон,Мебель на заказ; Мягкая мебель; Мебель для кухни; Корпусная мебель; Детская мебель,"улица 30 лет Победы, 4а ст3",,625007,,Калининский округ,Тюмень,Тюмень городской округ,Тюменская область,Россия,Пн: 10:00-19:00; Вт: 10:00-19:00; Ср: 10:00-19:00; Чт: 10:00-19:00; Пт: 10:00-19:00; Сб: 10:00-19:00; Вс: 10:00-19:00,+05:00,1.4,2,89966411732,,,,,,,,,,,,,,,,https://t.me/+79097341585,,,,57.130839,65.552658,https://2gis.com/firm/70000001100230215,branch
Каса нова,студия мебели,Мебель на заказ; Изделия из камня для помещений; Корпусная мебель; Мебель для кухни; Мебель для ванных комнат,"улица Парфёнова, 40",1 этаж; вход с ул. Парфёнова,625023,КПД м-н,Ленинский округ,Тюмень,Тюмень городской округ,Тюменская область,Россия,Пн: 10:00-19:00; Вт: 10:00-19:00; Ср: 10:00-19:00; Чт: 10:00-19:00; Пт: 10:00-19:00; Сб: 10:00-19:00; Вс: 10:00-19:00,+05:00,4.9,183,83452358010,89827871211,,casanova.s@mail.ru,,http://casanova.2gis.biz,http://t.me/casanova_mebel,http://jivo.chat/AfbVdpMVC1,,https://vk.com/kuxnicasanova,,,,,,,https://t.me/CASANOVA_studia,,,,57.130883,65.586582,https://2gis.com/firm/70000001052932162,branch
Каскад-мн,производственно-торговая компания,Мебель на заказ; Мебельные фабрики; Детская мебель; Корпусная мебель; Мебель для кухни; Мебель для учебных учреждений; Офисная мебель,"улица Высоцкого, 31",2 этаж,625014,Зайкова м-н,Ленинский округ,Тюмень,Тюмень городской округ,Тюменская область,Россия,Пн: 08:00-17:00; Вт: 08:00-17:00; Ср: 08:00-17:00; Чт: 08:00-17:00; Пт: 08:00-17:00,+05:00,5.0,4,83452520352 (доп.4),,,,,,,,,,,,,,,,,,,,57.117648,65.668962,https://2gis.com/firm/70000001018454727,branch
Катади,мебельная компания,Мебель на заказ; Мебель для кухни; Корпусная мебель; Детская мебель; Мебель для учебных учреждений; Мебель для ванных комнат,"улица Ю.-Р.Г. Эрвье, 22",2 этаж,625022,,Центральный округ,Тюмень,Тюмень городской округ,Тюменская область,Россия,Вт: 10:00-19:00; Ср: 10:00-19:00; Чт: 10:00-19:00; Сб: 10:00-19:00; Вс: 10:00-19:00,+05:00,4.7,28,89504857375 (офис продаж),89044915370,,,,,,,,https://vk.com/katadi,https://wa.me/79504857375,,,,,,https://t.me/+79504857375,,,,57.172868,65.567089,https://2gis.com/firm/1830115630211685,branch
Квадрат 72 мебель,,Мебель на заказ; Мебельные фабрики; Корпусная мебель; Детская мебель; Матрасы; Мебель для ванных комнат; Мебель для кухни; Офисная мебель,"Ветеранов Труда, 50",1 этаж,625031,,Ленинский округ,Тюмень,Тюмень городской округ,Тюменская область,Россия,Пн: 09:00-18:00; Вт: 09:00-18:00; Ср: 09:00-18:00; Чт: 09:00-18:00; Пт: 09:00-18:00; Сб: 09:00-18:00 (по предварительному звонку),+05:00,5.0,21,89923074437,,,,,http://t.me/kvadrat72mebel,,,,https://vk.com/kvadrat72mebel,https://wa.me/79923074437,,,viber://chat/?number=79923074437,,,,,,,57.194428,65.597924,https://2gis.com/firm/70000001066710740,branch
Квартет,мебельная компания,Мебель на заказ; Мебельные фасады; Корпусная мебель; Мебель для ванных комнат; Мебель для кухни; Медицинская и лабораторная мебель; Мебель для учебных учреждений; Мягкая мебель; Офисная мебель; Мебель для культурно-досуговых учреждений; Детская мебель; Мебель для общественного питания,"проезд Воронинские горки, 158 ст10",,625001,,Калининский округ,Тюмень,Тюмень городской округ,Тюменская область,Россия,Пн: 09:00-19:00; Вт: 09:00-19:00; Ср: 09:00-19:00; Чт: 09:00-19:00; Пт: 09:00-19:00; Сб: 09:00-19:00 (по предварительному звонку),+05:00,5.0,59,83452216909,83452216808,89582560059,,,,,,,https://vk.com/mkkvartet,,,,,,,https://t.me/+79963207938,,,,57.183173,65.469206,https://2gis.com/firm/70000001048143232,branch
Квартирный вопрос,компания по производству мебели,Мебель на заказ; Корпусная мебель; Мебель для кухни; Детская мебель; Офисная мебель,"улица Константина Посьета, 16",,625042,,Восточный округ,Тюмень,Тюмень городской округ,Тюменская область,Россия,Пн: 10:00-20:00; Вт: 10:00-20:00; Ср: 10:00-20:00; Чт: 10:00-20:00; Пт: 10:00-20:00; Сб: 10:00-20:00 (по предварительной записи: пн-сб),+05:00,5.0,16,89504928587 (производство),89199305885 (менеджер),,,,,,,,https://vk.com/tks13,https://wa.me/79199305885,https://wa.me/79923183898,,viber://chat/?number=79199305885,viber://chat/?number=79923183898,,https://t.me/+79923183898,https://t.me/+79199305885,,,57.09648,65.575123,https://2gis.com/firm/70000001026124422,branch
Квартирный Вопрос,шоурум отделочных материалов,Мебель на заказ; Отделочные материалы; Керамогранит; Напольные покрытия; Лаки и краски; Обои; Светотехника; Интерьерные лестницы; Керамическая плитка; Стеновые панели; Натяжные потолки; Погонажные изделия; Межкомнатные двери; Комплектующие для дверей; Декоративные отделочные материалы; Облицовочный камень,"улица Федюнинского, 62",2 этаж,625042,,Восточный округ,Тюмень,Тюмень городской округ,Тюменская область,Россия,Пн: 09:00-18:00; Вт: 09:00-18:00; Ср: 09:00-18:00; Чт: 09:00-18:00; Пт: 09:00-18:00,+05:00,5.0,2,89220497639,,,kv.shou-rum.72@yandex.ru,,,,,,,https://wa.me/79220497639,,,,,,https://t.me/+79220497639,,,,57.099978,65.569389,https://2gis.com/firm/70000001106126281,branch
Кедрач,столярная мастерская,Мебель на заказ; Корпусная мебель; Офисная мебель; Мебель для культурно-досуговых учреждений; Садово-парковая мебель,"Широтная улица, 200 к2 ст14",,625053,,Восточный округ,Тюмень,Тюмень городской округ,Тюменская область,Россия,Пн: 08:00-19:00; Вт: 08:00-19:00; Ср: 08:00-19:00; Чт: 08:00-19:00; Пт: 08:00-19:00; Сб: 09:00-15:00,+05:00,5.0,1,89995478775,,,,,,,,,https://vk.com/kedrachh,https://wa.me/79995478775,,,,,,https://t.me/+79995478775,,,,57.088766,65.63595,https://2gis.com/firm/70000001100233562,branch
Компания Паллада,,Мебель на заказ; Мебельные фасады; Корпусная мебель; Мебель для кухни; Детская мебель; Офисная мебель; Мебель для ванных комнат; Мебель для учебных учреждений; Ремонт мебели,"улица Дружбы, 128/1 ст3",1 этаж,625031,,Центральный округ,Тюмень,Тюмень городской округ,Тюменская область,Россия,Пн: 08:30-17:00; Вт: 08:30-17:00; Ср: 08:30-17:00; Чт: 08:30-17:00; Пт: 08:30-15:00 (по предварительному звонку),+05:00,5.0,2,89827719403,,,,,,,,,https://vk.com/club117233375,https://wa.me/79827719403,,,,,,https://t.me/+79827719403,,,,57.17789,65.587035,https://2gis.com/firm/1830115629855902,branch
Компания по изготовлению мебели в стиле лофт,,Мебель на заказ; Корпусная мебель; Заборы и ограждения,"Широтная улица, 108 к5",,625046,МЖК м-н,Восточный округ,Тюмень,Тюмень городской округ,Тюменская область,Россия,Пн: 09:00-18:00; Вт: 09:00-18:00; Ср: 09:00-18:00; Чт: 09:00-18:00; Пт: 09:00-18:00 (по предварительному звонку),+05:00,,,89233542157,,,,,,,,,,,,,,,,,,,,57.10741,65.583927,https://2gis.com/firm/70000001100689986,branch
Компания по изготовлению мебели на заказ,,Мебель на заказ; Корпусная мебель; Мебель для кухни,"улица Дружбы, 128/1 ст5",,625031,,Центральный округ,Тюмень,Тюмень городской округ,Тюменская область,Россия,,+05:00,,,89199397269,,,,,,,,,,,,,,,,,,,,57.177137,65.588143,https://2gis.com/firm/70000001112972245,branch
Компания по производству мебели на заказ,,Мебель на заказ; Корпусная мебель; Мебель для кухни; Мебельные фасады; Мебель для ванных комнат,"улица Малышева, 2а ст3",1 этаж,625029,Тарманы м-н,Ленинский округ,Тюмень,Тюмень городской округ,Тюменская область,Россия,Пн: 09:00-18:00; Вт: 09:00-18:00; Ср: 09:00-18:00; Чт: 09:00-18:00; Пт: 09:00-18:00,+05:00,5.0,3,89199406832,89504841140,,,,,,,,https://vk.com/club127808247,https://wa.me/79199406832,https://wa.me/79504841140,,,,,,,,,57.191539,65.61012,https://2gis.com/firm/70000001088901739,branch
Компания по производству стекол и зеркал с подсветкой,,Мебель на заказ; Стекло и зеркала; Мебель из стекла; Мебель для салонов красоты,"улица 30 лет Победы, 31а",104 цех,625016,,Восточный округ,Тюмень,Тюмень городской округ,Тюменская область,Россия,Пн: 08:00-19:00; Вт: 08:00-19:00; Ср: 08:00-19:00; Чт: 08:00-19:00; Пт: 08:00-19:00; Сб: 09:00-16:00; Вс: 09:00-16:00 (по предварительному звонку),+05:00,4.6,34,89199558821,89821310288,,,,,,,,,https://wa.me/79199558821,https://wa.me/79821310288,,,,,https://t.me/+79199558821,,,,57.12557,65.57275,https://2gis.com/firm/70000001083756267,branch
Компания по производству торговой мебели лофт,,Мебель на заказ; Торгово-выставочное оборудование; Мебель для кухни; Офисная мебель; Металлическая мебель,"Кремлёвская улица, 39/1",вывеска Полимер центр,625049,,Калининский округ,Тюмень,Тюмень городской округ,Тюменская область,Россия,"Пн: 09:00-13:00, 14:00-18:00; Вт: 09:00-13:00, 14:00-18:00; Ср: 09:00-13:00, 14:00-18:00; Чт: 09:00-13:00, 14:00-18:00; Пт: 09:00-13:00, 14:00-18:00",+05:00,,,89504841170,,,,,,,,,,https://wa.me/79504841170,,,,,,https://t.me/+79504841170,,,,57.137818,65.487842,https://2gis.com/firm/70000001098638772,branch
Комфорт,мебельный магазин,Мебель на заказ; Мебельные магазины; Мягкая мебель; Детская мебель; Корпусная мебель,"улица Мельникайте, 126/3",1 этаж,625007,,Калининский округ,Тюмень,Тюмень городской округ,Тюменская область,Россия,Пн: 10:00-20:00; Вт: 10:00-20:00; Ср: 10:00-20:00; Чт: 10:00-20:00; Пт: 10:00-20:00; Сб: 10:00-20:00; Вс: 10:00-20:00,+05:00,3.8,3,89068201212,,,,,,,,,,https://wa.me/79676169144,,,viber://chat/?number=79676169144,,,https://t.me/+79068201212,,,,57.126676,65.553598,https://2gis.com/firm/70000001089344584,branch
Комфорт,мебельный салон,Мебель на заказ; Мебельные магазины; Мягкая мебель; Детская мебель; Корпусная мебель; Мебель для кухни,"Барабинская улица, 50",2 этаж,625034,,Ленинский округ,Тюмень,Тюмень городской округ,Тюменская область,Россия,Пн: 10:00-18:00; Вт: 10:00-18:00; Ср: 10:00-18:00; Чт: 10:00-18:00; Пт: 10:00-18:00; Сб: 10:00-18:00; Вс: 10:00-17:00,+05:00,5.0,1,89044944344,,,,,,,,,https://vk.com/komforttmn,https://wa.me/79044944344,,,viber://chat/?number=79044944344,,,,,,https://youtube.com/@user-hy4hm4ib8d/about,57.15592,65.611776,https://2gis.com/firm/70000001031361498,branch
Комфорт+,салон мебели,Мебель на заказ; Мебельные магазины; Мягкая мебель; Корпусная мебель,"улица 30 лет Победы, 91а",цокольный этаж; с лифта налево,625051,,Восточный округ,Тюмень,Тюмень городской округ,Тюменская область,Россия,Пн: 10:00-19:00; Вт: 10:00-19:00; Ср: 10:00-19:00; Чт: 10:00-19:00; Пт: 10:00-19:00; Сб: 10:00-19:00; Вс: 10:00-19:00,+05:00,4.8,22,89123861038,,,,,,,,,,https://wa.me/79123861038,,,,,,https://t.me/+79123861038,,,,57.117613,65.591048,https://2gis.com/firm/70000001050264009,branch
Континент Мебели,,Мебель на заказ; Мебель для кухни; Корпусная мебель,,,,,,Тюмень,Тюмень городской округ,Тюменская область,Россия,,+05:00,5.0,3,89994306677,,,,,,,,,https://vk.com/mebel_888_72,,,,,,,,,,,,,https://2gis.com/firm/70000001110915822,branch
КонтурСталь,производственная компания,Мебель на заказ; Металлоконструкции для строительства; Металлоизделия; Интерьерные лестницы; Металлообработка; Металлическая мебель; Сварочные работы,"улица Чекистов, 30 ст7",,625014,Строителей пос.,Ленинский округ,Тюмень,Тюмень городской округ,Тюменская область,Россия,Пн: 08:00-19:00; Вт: 08:00-19:00; Ср: 08:00-19:00; Чт: 08:00-19:00; Пт: 08:00-19:00; Сб: 08:00-19:00; Вс: 08:00-19:00,+05:00,,,89220488400,,,,,,,,,,,,,,,,,,,,57.113248,65.650106,https://2gis.com/firm/70000001112939155,branch
Концепт,компания по производству шкафов и кухонь на заказ,Мебель на заказ; Мебель для кухни; Корпусная мебель,,,625054,Пушкин коттеджный пос.,Центральный округ,Тюмень,Тюмень городской округ,Тюменская область,Россия,Пн: 10:00-18:00; Вт: 10:00-18:00; Ср: 10:00-18:00; Чт: 10:00-18:00; Пт: 10:00-18:00,+05:00,3.2,3,89612012481,,,,,,,,,https://vk.com/concept_mebel72,,,,,,,,,,,57.250065,65.504613,https://2gis.com/firm/70000001105988962,branch
Короед,мебель на заказ,Мебель на заказ; Мебель для ванных комнат; Корпусная мебель; Мебель для кухни; Детская мебель; Офисная мебель,,,,,,,Тюменский район,Тюменская область,Россия,Пн: 09:00-20:00; Вт: 09:00-20:00; Ср: 09:00-20:00; Чт: 09:00-20:00; Пт: 09:00-20:00; Сб: 09:00-20:00; Вс: 09:00-20:00,+05:00,5.0,15,89205132238,,,,,http://t.me/mebelkoroed,,,,https://vk.com/club226461030,https://wa.me/79205132238,,,,,,https://t.me/+79205132238,,,,,,https://2gis.com/firm/70000001094153893,branch
Корпорация мебели,,Мебель на заказ; Корпусная мебель; Детская мебель; Мебель для кухни; Мебель для ванных комнат,,,,,,Тюмень,Тюмень городской округ,Тюменская область,Россия,Пн: 09:00-18:00; Вт: 09:00-18:00; Ср: 09:00-18:00; Чт: 09:00-18:00; Пт: 09:00-18:00; Сб: 09:00-18:00; Вс: 09:00-18:00,+05:00,,,89224781254,,,,,,,,,,https://wa.me/79224781254,,,viber://chat/?number=79224781254,,,,,,,,,https://2gis.com/firm/70000001035490142,branch
Креатив,компания по производству мебели,Мебель на заказ; Корпусная мебель; Мебель для кухни; Детская мебель; Офисная мебель,"улица Дружбы, 128 к6",1 этаж,625031,,Центральный округ,Тюмень,Тюмень городской округ,Тюменская область,Россия,Пн: 09:00-18:00; Вт: 09:00-18:00; Ср: 09:00-18:00; Чт: 09:00-18:00; Пт: 09:00-18:00; Сб: 10:00-15:00 (по предварительному звонку),+05:00,5.0,14,89829235688,89829374074,,,,,,,,https://vk.com/kreativ72ru,https://wa.me/79829235688,,,,,,https://t.me/+79829235688,,,,57.176867,65.58659,https://2gis.com/firm/70000001096327080,branch
Крона мебель,мебельная компания,Мебель на заказ; Корпусная мебель; Мебель для кухни; Мебель для ванных комнат; Офисная мебель; Ремонт мебели; Детская мебель; Строительство бань и саун; Садово-парковая мебель; Интерьерные лестницы; Мебель для учебных учреждений; Мебель для культурно-досуговых учреждений; Мебель для общественного питания; Металлическая мебель,"улица Механизаторов, 67а",,625017,РТС м-н,Калининский округ,Тюмень,Тюмень городской округ,Тюменская область,Россия,Пн: 09:00-20:00; Вт: 09:00-20:00; Ср: 09:00-20:00; Чт: 09:00-20:00; Пт: 09:00-20:00; Сб: 09:00-18:00; Вс: 09:00-18:00 (по предварительному звонку: пн-вс),+05:00,4.6,15,89292691510,,,,,,,,,https://vk.com/krona_mebel72,https://wa.me/79292691510,,,viber://chat/?number=79292691510,,,https://t.me/+79222666241,,,,57.152819,65.456096,https://2gis.com/firm/70000001027316570,branch
Куб,компания по изготовлению мебели на заказ,Мебель на заказ; Мебель для кухни; Корпусная мебель; Изделия из камня для помещений,"Камчатская улица, 183",2 этаж,625034,Тура м-н,Ленинский округ,Тюмень,Тюмень городской округ,Тюменская область,Россия,Пн: 10:00-17:00; Вт: 10:00-17:00; Ср: 10:00-17:00; Чт: 10:00-17:00; Пт: 10:00-17:00,+05:00,5.0,18,89923093239,,,,,,,,,https://vk.com/koobmebel,,,,,,,,,,,57.157151,65.665587,https://2gis.com/firm/70000001064619555,branch
Кухни Модуль,компания,Мебель на заказ; Мебельные магазины; Мебель для ванных комнат; Мебель для кухни; Корпусная мебель; Офисная мебель,"улица Василия Гольцова, 10",2 этаж,625051,Тюменский 1-й м-н,Восточный округ,Тюмень,Тюмень городской округ,Тюменская область,Россия,Пн: 11:00-18:00; Вт: 11:00-18:00; Ср: 11:00-18:00; Чт: 11:00-18:00; Пт: 11:00-18:00,+05:00,4.8,15,89523465097,89129969311,,,,,,,,,https://wa.me/79523465097,,,viber://chat/?number=79523465097,,,https://t.me/+79523465097,,,,57.110194,65.573973,https://2gis.com/firm/70000001046526413,branch
Кухни.рф,компания по изготовлению мебели,Мебель на заказ; Мебель для кухни; Детская мебель; Корпусная мебель; Мебель для ванных комнат; Ремонт мебели,"Старый Тобольский тракт 5 километр, 3",цокольный этаж,625047,Антипино м-н,Ленинский округ,Тюмень,Тюмень городской округ,Тюменская область,Россия,Пн: 09:00-18:00; Вт: 09:00-18:00; Ср: 09:00-18:00; Чт: 09:00-18:00; Пт: 09:00-18:00; Сб: 09:00-18:00,+05:00,4.7,15,89829089296,,,,,http://jivo.chat/BrRfL7Ko6L,,,,https://vk.com/kuhnirf,https://wa.me/79829089296,,,,,,https://t.me/+79829089296,,,,57.110089,65.752931,https://2gis.com/firm/70000001066160007,branch
